author,old_author,title,old_title,sub_title,old_sub_title,publisher,old_publisher,publication_date,old_publication_year,old_original_title,old_original_subtitle,old_purchase_date,old_my_rating,image_name,old_cover,old_categories,isbn-13,isbn-10,old_isbn,old_took,old_notes,format,old_print_format,nof_pages,old_read_it,description,old_description,language,language_iso
,"Kazuo Koike, Will Jacobs, Ryoichi Ikegami",,Crying Freeman,,A Taste of Revenge Vol 1,,Viz,,nan,nan,nan,2016-10-09,0,,https://books.google.ru/books/content?id=_r_EOAAACAAJ&printsec=frontcover&img=1&source=gbs_api,Comics & Graphic Novels,,,929279891,nan,nan,,nan,,No,,nan,,
,"Kazuo Koike, Will Jacobs, Ryoichi Ikegami",,Crying Freeman,,A Taste of Revenge Vol 2,,Viz,,nan,nan,nan,2016-10-09,0,,https://books.google.ru/books/content?id=_r_EOAAACAAJ&printsec=frontcover&img=1&source=gbs_api,Comics & Graphic Novels,,,929279905,nan,nan,,nan,,No,,nan,,
,Kazuo Koike,,Crying Freeman,,Abduction in Chinatown,,nan,,nan,nan,nan,2016-10-09,0,,nan,nan,,,,nan,nan,,nan,,No,,nan,,
,Kazuo Koike,,Crying Freeman,,Journey to Freedom Vol 1,,nan,,nan,nan,nan,2016-10-09,0,,nan,nan,,,,nan,nan,,nan,,No,,nan,,
,Kazuo Koike,,Crying Freeman,,Journey to Freedom Vol 2,,nan,,nan,nan,nan,2016-10-09,0,,nan,nan,,,,nan,nan,,nan,,No,,nan,,
,Kazuo Koike,,Crying Freeman,,Portrait of a Killer Part 1,,nan,,nan,nan,nan,2016-10-09,0,,nan,nan,,,,nan,nan,,nan,,No,,nan,,
,Kazuo Koike,,Crying Freeman,,Portrait of a Killer Part 2,,nan,,nan,nan,nan,2016-10-09,0,,nan,nan,,,,nan,nan,,nan,,No,,nan,,
,Kazuo Koike,,Crying Freeman,,Shades of Death Vol 1,,nan,,nan,nan,nan,2016-10-09,0,,nan,nan,,,,nan,nan,,nan,,No,,nan,,
,Kazuo Koike,,Crying Freeman,,Shades of Death Vol 2,,nan,,nan,nan,nan,2016-10-09,0,,nan,nan,,,,nan,nan,,nan,,No,,nan,,
,Kazuo Koike,,Crying Freeman,,Shades of Death Vol 3,,nan,,nan,nan,nan,2016-10-09,0,,nan,nan,,,,nan,nan,,nan,,No,,nan,,
Frank Miller,nan,Daredevil,Daredevil, The Man Without Fear,The Man Without Fear,Marvel,Marvel,2010-06-16,nan,nan,nan,2017-01-18,0,9780785134794.jpg,https://books.google.ru/books/content?id=u-AkPwAACAAJ&printsec=frontcover&img=1&source=gbs_api,Comics & Graphic Novels,9780785134794,0785134794,9780785134794,nan,nan,Paperback,nan,224,No,"A fire burns deep within Matt Murdock. He was raised by a single father, an over-the-hill prizefighter with one last chance to make it good - a chance that cost him his life. Taunted and tormented by children while growing up, Matt&apos;s life was irrevocably altered after he was blinded by radioactive materials while saving the life of an old man. The payoff? An unbreakable will and a keen intelligence, helping focus the super-senses he was blessed with during the accident. His story is one of love, pain, disappointment and strength. Witness the tour-de-force origin of the Man Without Fear by industry legends Frank Miller and John Romita Jr.Collects Daredevil: The Man Without Fear #1-5.","A fire burns deep within Matt Murdock. He was raised by a single father, an over-the-hill prizefighter with one last chance to make it good - a chance that cost him his life. Taunted and tormented by children while growing up, Matt's life was irrevocably altered after he was blinded by radioactive materials while saving the life of an old man. The payoff? An unbreakable will and a keen intelligence, helping focus the super-senses he was blessed with during the accident. His story is one of love, pain, disappointment, and strength. Witness the tour-de-force origin of the Man Without Fear by industry legends Frank Miller and John Romita Jr. Collects Daredevil: The Man Without Fear #1-5",English,en
Frank Miller,"Frank Miller, Klaus Janson",DAREDEVIL BY FRANK MILLER & KLAUS JANSON VOL. 1,Daredevil Vol. 1,,nan,Marvel,nan,2008-11-19,nan,nan,nan,2018-12-16,0,9780785134732.jpg,nan,nan,9780785134732,0785134735,9780785134732,nan,nan,Paperback,nan,336,No,"A classic Marvel hero defined by one of comics' greatest visionaries! A Marvel Comics mainstay since 1964, Daredevil got a new lease on life in a landmark 1979-1983 run by writer-penciler Frank Miller and inker-penciler Klaus Janson, whose daring reinvention of the character quickly made Miller one of the biggest and most influential stars in the comic-book industry.Miller put his own stamp on established cast members such as reporter Ben Urich, femme fatale Black Widow, mad assassin Bulls",nan,English,en
Mark Waid,Mark Waid,"Daredevil, Vol. 1",Daredevil Vol. 1,,Devil at Bay,Marvel,Marvel Entertainment,2012-08-08,2012.0,nan,nan,2016-06-18,0,9780785152385.jpg,https://books.google.ru/books/content?id=0F2DBAAAQBAJ&printsec=frontcover&img=1&source=gbs_api,Comics & Graphic Novels,9780785152385,0785152385,9780785152385,nan,nan,Paperback,Paperback,152,No,,"Collects Daredevil #1-5, #0.1.",English,en
Mark Waid,Mark Waid,"Daredevil, Vol. 2",Daredevil Vol. 2,,nan,Marvel,Marvel Entertainment,2012-12-26,2012.0,nan,nan,2016-06-18,0,9780785152408.jpg,https://books.google.ru/books/content?id=B_dwBgAAQBAJ&printsec=frontcover&img=1&source=gbs_api,Comics & Graphic Novels,9780785152408,0785152407,9780785152408,nan,nan,Paperback,Paperback,136,No,,nan,English,en
Frank Miller,"Frank Miller, Klaus Janson",DAREDEVIL BY FRANK MILLER & KLAUS JANSON VOL. 2,Daredevil Vol. 2,,nan,Marvel,nan,2008-12-17,nan,nan,nan,2018-12-16,0,9780785134749.jpg,nan,nan,9780785134749,0785134743,9780785134749,nan,nan,Paperback,nan,328,No,"A classic Marvel hero redefined by one of comics' greatest visionaries! A Marvel Comics mainstay since 1964, Daredevil got a new lease on life in a landmark 1979-1983 run by writer-penciler Frank Miller and inker-penciler Klaus Janson, whose daring reinvention of the character quickly made Miller one of the biggest and most influential stars in the comic-book industry.Miller puts his own stamp on established cast member such as reporter Ben Urich, femme fatale Black Widow, mad assassin Bu",nan,English,en
Mark Waid,Mark Waid ,"Daredevil, Vol. 3",Daredevil Vol. 3,,nan,Marvel,Marvel Entertainment,2013-04-02,2013.0,nan,nan,2016-06-18,0,9780785161011.jpg,https://books.google.ru/books/content?id=E2mrCQAAQBAJ&printsec=frontcover&img=1&source=gbs_api,Comics & Graphic Novels,9780785161011,0785161015,9780785161011,nan,nan,Paperback,Paperback,160,No,,Daredevil's recent traumas have left him coping in an unexpected way! A mystery that's been building since issue one starts to pay off big! San Francisco now has two men without fear -- and only one will be left standing! Collecting Daredevil (2014) #11-15.,English,en
Mark Waid,Mark Waid,Daredevil by Mark Waid Volume 4,Daredevil Vol. 4,,nan,Marvel,Marvel Entertainment,2013-09-17,2013.0,nan,nan,2016-06-18,0,9780785161035.jpg,https://books.google.ru/books/content?id=JecIAwAAQBAJ&printsec=frontcover&img=1&source=gbs_api,Comics & Graphic Novels,9780785161035,0785161031,9780785161035,nan,nan,Paperback,nan,136,No,,"Collects Daredevil (2011) #16-21. Nelson & Murdock is no more! Foggy's discovered a shocking secret that Matt's been keeping - and he doesn't take it well! It's a turning point in the lives of Marvel's most famous legal team! Then, it's the return of someone Matt thought was gone forever, and the debut of a new menace in New York...the killer called Coyote! Daredevil's newest threat is not what Matt expects...but then again, just how sane is Matt Murdock right now, anyway? The biggest Daredevil story yet begins here, as the streets of New York run red with blood and Matt's mind unravels under the Coyote-created chaos!",English,en
Mark Waid,Mark Waid,Daredevil by Mark Waid Volume 5,Daredevil Vol. 5,,nan,Marvel,Marvel Entertainment,2014-04-29,2014.0,nan,nan,2016-06-18,0,9780785161059.jpg,https://books.google.ru/books/content?id=69ceAwAAQBAJ&printsec=frontcover&img=1&source=gbs_api,Comics & Graphic Novels,9780785161059,0785161058,9780785161059,nan,nan,Paperback,nan,144,No,,"Collects Daredevil 22-27. A mystery takes Daredevil to the edge like never before! When Matt Murdock receives fateful news about someone close to him, will he be forced to abandon his super-hero identity to save one of his dearest friends? As a life-or-death medical drama plays out in Matt 's personal life, the hidden foe behind Daredevil's recent troubles steps out of the shadows to play his trump card. The Man Without Fear comes face-to-face with his opposite number - an unstoppable enemy with a mysterious connecti on to the accident that gave young Matt Murdock his powers.",English,en
Mark Waid,"Mark Waid, Tom Peyer",Daredevil by Mark Waid Volume 6,Daredevil Vol. 6,,nan,Marvel,Marvel Entertainment,2014-09-09,2013.0,nan,nan,2016-06-18,0,9780785166795.jpg,https://books.google.ru/books/content?id=86Y9BAAAQBAJ&printsec=frontcover&img=1&source=gbs_api,Comics & Graphic Novels,9780785166795,0785166793,9780785166795,nan,nan,Paperback,Paperback,112,No,,"Collects Daredevil #28-30, Indestructible Hulk #9-10. There was one man young Daredevil feared and now Matt Murdock is representing him in court. The minor demons of Matt Murdock's past lead to some Daredevil sized present problems.",English,en
Mark Waid,Mark Waid,Daredevil by Mark Waid Volume 7,Daredevil Vol. 7,,nan,Marvel,Marvel Entertainment,2015-01-06,nan,nan,nan,2017-04-06,0,9780785189619.jpg,https://books.google.com/books/content?id=CcOVBQAAQBAJ&printsec=frontcover&img=1&source=gbs_api,Comics & Graphic Novels,9780785189619,0785189610,9780785189619,nan,nan,Paperback,nan,136,No,,Collects Daredevil #31-36.,English,en
Charles Soule,nan,Daredevil,Daredevil: Back in Black Vol. 1, Back in Black Vol. 1: Chinatown,nan,Marvel,Marvel,2016-05-24,nan,nan,nan,2016-06-18,0,9780785196440.jpg,https://books.google.ru/books/content?id=bG9vjgEACAAJ&printsec=frontcover&img=1&source=gbs_api,Comics & Graphic Novels,9780785196440,0785196447,9780785196440,nan,nan,Paperback,nan,120,No,,"Daredevil is back in black and back on his home turf, as Matt Murdock begins a fresh life once again! He may have returned to New York City, but Matt's on a different side of the law now, with a job in the District Attorney's office. And he's finding his new career quite the challenge, as even his incredible skills aren't enough to indict the local crime lord known as Tenfingers. Could this be a job for Daredevil? Fighting crime in the shadows, prosecuting bad guys in the light, it's a whole new chapter for the Man Without Fear - and it comes with a protégé. Welcome to Hell, Blindspot - you'll soon find that life with DD comes with more than its fair share of Hand ninjas out for your blood! COLLECTING: DAREDEVIL 1-5; ALL-DIFFERENT POINT ONE 1 (DD STORY)",English,en
Charles Soule,nan,Daredevil,Daredevil: Back in Black Vol. 2, Back in Black Vol. 2: Supersonic,nan,Marvel,Marvel,2016-10-04,nan,nan,nan,2016-10-17,0,9780785196457.jpg,https://books.google.ru/books/content?id=zXayjwEACAAJ&printsec=frontcover&img=1&source=gbs_api,Comics & Graphic Novels,9780785196457,0785196455,9780785196457,nan,nan,Paperback,nan,120,No,,"Matt Murdock is back in his old stomping grounds of New York City, and somehow he has managed to hide his secret identity from the world once again. But there are some parts of his past that Matt can never escape. Ghosts like the first woman he ever loved and lost. Now, Elektra Natchios is back in the Big Apple and she's got a deadly score to settle with the Man Without Fear! This will be far from a happy reunion, as Hell's Kitchen knows no fury like an assassin scorned. Daredevil's dark new direction continues! COLLECTING: DAREDEVIL 6-9, Annual 1",English,en
Charles Soule,nan,Daredevil,Daredevil: Back In Black Vol. 3, Back in Black Vol. 3: Dark Art (Daredevil (Paperback)),Dark Art,Marvel,nan,2017-03-07,nan,nan,nan,2017-11-19,0,9781302902971.jpg,nan,nan,9781302902971,1302902970,9781302902971,nan,nan,Paperback,nan,112,No,,nan,English,en
Charles Soule,nan,Daredevil,Daredevil: Back In Black Vol. 4, Back in Black Vol. 4: Identity,Identity,Marvel,nan,2017-08-01,nan,nan,nan,2017-11-19,0,9781302905620.jpg,nan,nan,9781302905620,1302905627,9781302905620,nan,nan,Paperback,nan,136,No,,nan,English,en
Charles Soule,nan,Daredevil,Daredevil: Back in Black Vol. 5, Back in Black Vol. 5: Supreme,Supreme,Marvel,nan,2017-12-12,nan,nan,nan,2019-05-24,0,9781302905637.jpg,nan,nan,9781302905637,1302905635,9781302905637,nan,nan,Paperback,nan,112,No,,nan,English,en
Charles Soule,nan,Daredevil,Daredevil: Back in Black Vol. 6, Back in Black Vol. 6: Mayor Fisk,Mayor Fisk,Marvel,nan,2018-08-07,nan,nan,nan,2019-05-24,0,9781302910624.jpg,nan,nan,9781302910624,1302910620,9781302910624,nan,nan,Paperback,nan,136,No,,nan,English,en
Charles Soule,nan,Daredevil,Daredevil: Back in Black Vol. 7, Back in Black Vol. 7: Mayor Murdock,Mayor Murdock,Marvel,nan,2018-12-31,nan,nan,nan,2019-05-24,0,9781302910631.jpg,nan,nan,9781302910631,1302910639,9781302910631,nan,nan,Paperback,nan,112,No,,nan,English,en
Moore,nan,Dcs Universum,DC:s Universum,,Klassiska serier av Alan Moore,,nan,,nan,nan,nan,2016-10-09,0,,nan,nan,9789172698031,9172698039,9789172698031,nan,nan,,nan,,No,,nan,Swedish,sv
Geoff Johns,nan,Doomsday Clock Part 1,Doomsday Clock Part 1,,nan,DC Comics,nan,2019-10-08,nan,nan,nan,2019-10-13,0,9781779501202.jpg,nan,nan,9781779501202,177950120X,9781779501202,nan,nan,Hardcover,nan,224,No,,nan,English,en
,"Frank Miller, Lynn Varley",,Elektra Lives Again,,nan,,Marvel Enterprises,,nan,nan,nan,2016-10-09,0,,https://books.google.ru/books/content?id=whmfMAAACAAJ&printsec=frontcover&img=1&source=gbs_api,Comics & Graphic Novels,,,24885234077,nan,nan,,nan,,No,,"Frank Miller's run on Daredevil is notable for his introduction of the ninja, assassin Elektra. Even after dying in his arms, Daredevil's nightmares lead him to believe that Elektra may be alive. Miller crafts a story of discovery as DD sets out to find Elektra.",,
,"David Michelinie, Bob Hall",,Emperor Doom,,nan,,nan,,nan,nan,nan,2016-10-09,0,,nan,nan,,,,nan,nan,,nan,,No,,nan,,
J.T. Krul,J.T. Krul,Green Arrow Vol. 1,Green Arrow, Into the Woods,Into The Woods,DC Comics,DC Comics,2011-07-12,2011.0,nan,nan,2016-06-18,0,9781401230739.jpg,nan,nan,9781401230739,1401230733,9781401230739,nan,nan,Hardcover,Hardcover,192,No,"Once the self-centered billionaire of Queen Industries, Oliver Queen lost everything, but found a reason to live as the world s greatest archer and the ultimate hero of the people, Green Arrow. After Star City was devastated by an attack by the villain Prometheus in the pages of JUSTICE LEAGUE: CRY FOR JUSTICE, the White Lantern Ring gave birth to a massive, mysterious forest located at the center of the destruction. Now, Green Arrow lives in the woods and strikes against crime and corruption as a modern day Robin Hood.",nan,English,en
J.T. Krul,J.T. Krul,Green Arrow,Green Arrow, Salvation,Salvation,DC Comics,nan,2012-02-07,nan,nan,nan,2016-10-09,0,9781401233945.jpg,nan,nan,9781401233945,1401233945,9781401233945,nan,nan,Hardcover,nan,192,No,,nan,English,en
BRAD MELTZER,Brad Meltzer,Green Arrow,Green Arrow, Archer's Quest (Green Arrow Quiver Book 3),The Archer's Quest,DC Comics,DC Comics,2013-07-09,2004.0,nan,nan,2016-06-18,0,9781401247713.jpg,https://books.google.ru/books/content?id=TYhIAQAAQBAJ&printsec=frontcover&img=1&source=gbs_api,Comics & Graphic Novels,9781401247713,1401247717,9781401200442,nan,nan,,Paperback,176,No,,"Collecting GREEN ARROW #16-21 by Brad Meltzer (IDENTITY CRISIS)! The Emerald Archer returns from the dead and sets off on an adventure that tests his courage and brings formerly hidden facets of the Green Arrow legend to light. Featuring an introduction by Senator Patrick Leahy, a foreword by Greg Rucka (WONDER WOMAN), Meltzer's original notes to the series, and the script to issue #16.",English,en
,Jens Lapidus,,Gängkrig 145,,nan,,Wahlström &amp; Widstrand,,2009.0,nan,nan,2016-06-18,0,,https://books.google.ru/books/content?id=gd1OQwAACAAJ&printsec=frontcover&img=1&source=gbs_api,nan,,,9789146219552,nan,nan,,Paperback,,No,,"Tegneserie. Da Jiva al-Askori bliver voldtaget af sin bedste vens bror, er det startskuddet til en bandekrig i den sydlige del af Stockholm med postnummeret 145. Handlingen ligger i forlængelse af indholdet i Jens Lapidus' romaner ""Cash"" og ""Aldrig fucke op"".",,
Frank Miller,"Frank Miller, Dave Stewart",Holy Terror,Holy Terror,,nan,Legendary Comics LLC,Legendary Comics LLC,2011-10-11,2011.0,nan,nan,2016-06-18,0,9781937278007.jpg,https://books.google.ru/books/content?id=OvegZwEACAAJ&printsec=frontcover&img=1&source=gbs_api,Comics & Graphic Novels,9781937278007,193727800X,9781937278007,nan,nan,Hardcover,Hardcover,120,No,There's a deadly menace somewhere in Empire City and The Fixer only has until dawn to save his town - and civilization as we know it! Legendary Comics presents an all-out  head-busting  bone-breaking  neck-snapping brawl of a tale from the one of the most celebrated storytellers of the medium  Frank Miller. Years in the making  Holy Terror features a desperate and brutal quest of a hero as he is forced to run down an army of murderous zealots in order to stop a crime against humanity. From the bestselling  critically-acclaimed writer/artist Frank Miller  creator of Sin City  300  and The Dark Knight Returns. ;  ; ,"Chronicles the quest of ""the Fixer"" as he battles a deadly menace threatening Empire City and its inhabitants.",English,en
Geoff Johns,"Geoff Johns, Phil Jimenez",Infinite Crisis,Infinite Crisis,,nan,DC Comics,nan,2008-02-27,nan,nan,nan,2019-05-25,0,9781401210601.jpg,nan,nan,9781401210601,1401210600,9781401210601,nan,nan,Paperback,nan,264,No,"Written by Geoff Johns; Art by Phil Jimenez, George PÂ¿rez, Jerry Ordway, Ivan Reis, Andy Lanning and others; Cover by Jimenez The 7-issue miniseries event that rocked the entire DC Universe in 2005-2006 Â¿ a sequel to the epic CRISIS ON INFINITE EARTHS Â¿ is now available in an amazing softcover collection! OMAC robots are rampaging, magic is dying, villains are uniting, and a war is raging in space. And in the middle of it all, a critical moment has divided Earth&apos;s three greatest heroes: Superman, Batman and Wonder Woman. It&apos;s the DCU&apos;s darkest day, and long-lost heroes from the past have returned to make things right in the universe...at any cost. Heroes will live, heroes will die, and the DCU will never be the same again!This exhaustive volume contains every cover and variant produced for the project, annotations, character designs, excerpts from scripts, unused scenes, and much more!",nan,English,en
,John Arcudi,,JLA,,Superpower,,nan,,nan,nan,nan,2016-10-09,0,,nan,nan,,,761941216997,nan,nan,,nan,,No,,nan,,
Grant Morrison,Grant Morrison,JLA,JLA Vol. 1," The Deluxe Edition, Vol. 1",nan,DC Comics,nan,2011-10-04,nan,nan,nan,2019-05-24,0,9781401233143.jpg,nan,nan,9781401233143,1401233147,9781401233143,nan,nan,Paperback,nan,256,No,"Relive the legendary 1990s JLA series, written by comics mastermind Grant Morrison (FINAL CRISIS) with stunning art by Howard Porter and others, in this amazing oversized softcover collecting JLA #1-9 and SECRET FILES AND ORIGINS #1! The action begins as the JLA reunites to stop the Hyperclan, who have come to Earth posing as a new group of super heroes. But as their true nature comes to light, only the World`s Greatest Super Heroes can stop them! Standing side by side, Batman, Superman, Wonder Woman, Aquaman, The Flash, Green Lantern and the Martian Manhunter take on alien posers and come to realize that Earth needs a protectorate made up of only the mightiest icons!",nan,English,en
Grant Morrison,Grant Morrison,JLA,JLA Vol. 2," The Deluxe Edition, Vol. 2",nan,DC Comics,nan,2012-07-17,nan,nan,nan,2019-05-25,0,9781401235185.jpg,nan,nan,9781401235185,1401235182,9781401235185,nan,nan,Paperback,nan,336,No,,nan,English,en
Grant Morrison,Grant Morrison,JLA Vol. 3,JLA Vol. 3,,nan,DC Comics,nan,2013-01-22,nan,nan,nan,2019-05-24,0,9781401238322.jpg,nan,nan,9781401238322,1401238327,9781401238322,nan,nan,Paperback,nan,344,No,,nan,English,en
,Mark Waid,,Kingdom Come,,nan,,Dc Comics,,nan,nan,nan,2016-10-09,0,,https://books.google.ru/books/content?id=nN2wSqn0014C&printsec=frontcover&img=1&source=gbs_api,Comics & Graphic Novels,,,761941209869,nan,nan,,nan,,No,,"Kingdom Come-the critically acclaimed Elseworlds saga by Mark Waid and Alex Ross- has been collected into a single-volume hardcover, produced by DC Comics and Graphitti Designs. With the addition of 12 new pages of story and art, previously available only in the deluxe slipcase edition, the hardcover edition offers reader's the complete version of the DC Universe's ultimate battle. An extensive 18 page design section includes some of Ross's exhaustive preliminary character illustrations, cover legends, a key to cameo appearances, trading-card art and art originally designed for promotional use.",,
,"Kazuo Koike, Goseki Kojima",,Lone Wolf and Cub Volume 1: The Assassin's Road,,nan,,Dark Horse Comics,,nan,nan,nan,2016-10-09,0,,https://books.google.ru/books/content?id=0XQ2LAmQkHsC&printsec=frontcover&img=1&source=gbs_api,Comics & Graphic Novels,,,,nan,nan,,nan,,No,,"Dark Horse Comics is proud to present one of the authentic landmarks in graphic fiction, Lone Wolf and Cub, to be published in its entirety for the first time in America. An epic samurai adventure of staggering proportions -- over 7000 pages -- Lone Wolf and Cub (Kozure Okami in Japan) is acknowledged worldwide for the brilliant writing of series creator Kazuo Koike and the groundbreaking cinematic visuals of the late Goseki Kojima, creating unforgettable imagery of stark beauty, kinetic fury, and visceral thematic power that influenced a generation of visual storytellers both in Japan and in the West. Don't miss this monumental monthly release, twenty-eight volumes, with each collection approximately 300 pages! This volume includes the following stories: Son for Hire, Sword for Hire A Father Knows His Child's Heart, as Only a Child Can Know His Father's From North to South, From East to West Baby Cart on the River Styx Suio School Zanbato Waiting for the Rains Eight Gates of Deceit Wings to the Birds, Fangs to the Beast The Assassin's Road",,
,"Kazuo Koike, Goseki Kojima",,Lone Wolf and Cub Volume 10: Hostage Child,,nan,,Dark Horse Comics,,nan,nan,nan,2016-10-09,0,,https://books.google.ru/books/content?id=EnDjhEi4ZV0C&printsec=frontcover&img=1&source=gbs_api,Comics & Graphic Novels,,,,nan,nan,,nan,,No,,"The six paths and four lives are split asunder, as Itto Ogami and Daigoro become separated in one of this series' most powerful stories to date! The Lone Wolf's arch-enemy, Yagyu Retsudo, pursues Ogami to retrieve the secret letter stolen from him, only to watch dozens of his men fall victim to the Lone Wolf's hungry sword! But Yagyu drives father and son apart as they tumble down a cliff and must survive on their own! Little Daigoro must begin his honorable search for his father. But with Yagyu's henchmen hunting high and low for the Lone Wolf and his cub, the net drags closer and the danger wraps tighter, but the blood flows ever freely... This volume contains the following stories: The Yagyu Letter The Tears of Daigoro The Fisherwoman's Love Drifting Shadows Straw Boy",,
,"Kazuo Koike, Goseki Kojima",,Lone Wolf and Cub Volume 11: Talisman of Hades,,nan,,Dark Horse Comics,,nan,nan,nan,2016-10-09,0,,https://books.google.ru/books/content?id=wIDoAwAAQBAJ&printsec=frontcover&img=1&source=gbs_api,Comics & Graphic Novels,,,,nan,nan,,nan,,No,,"The #1-selling graphic-novel sensation continues! The Lone Wolf and his cub, father and son, are separated by the hatred of the Yagyu -- and the path to togetherness is lined with blood and honor. As Ogami continues his search for little Daigoro, he must battle deadly Yagyu assassins and aspiring, cocky samurai. He prepares to give them a taste of his blade... Meanwhile, Daigoro visits a crazed old woman living under a bridge, and teaches her a valuable lesson. In these and other stories in this volume, Lone Wolf and Cub continue to unlock the mystery of the Yagyu, one step closer to the truth behind his quest for vengeance. Prepare for more legendary action, in a handy size that fits in your back pocket! This volume contains the following stories: Talisman of Hades Ailing Star Thirteen Strings A Poem for the Grave",,
,"Kazuo Koike, Goseki Kojima, Dana Lewis",,Lone Wolf and Cub Volume 12: Shattered stones,,nan,,nan,,nan,nan,nan,2016-10-09,0,,https://books.google.ru/books/content?id=Oo8qAAAAYAAJ&printsec=frontcover&img=1&source=gbs_api,Fiction,,,,nan,nan,,nan,,No,,"A woman driven to insanity by the murder of her child, and the horribly burned husband seeking revenge; unseen samurai under the thumb of a power-hungry woman; a beggar ronin seeking the downfall of his greedily ambitious wife; a good-for-nothing beggar willing to use a child to make easy money; a lady magician threatened by swindling gangsters - all of these people have something in common - the need to regain their honor, and this quest almost always means death. Ogami Itto, a wandering ronin on a road to vengeance, has been paid to put these folks back on that path, at any cost. For this grim samurai and his infant son, there is nothing left in this world except honor, vengeance, death, and blood. Fortunately, there's plenty of each to go around...",,
